<?xml version="1.0" encoding="UTF-8" ?>
<xsd:schema xmlns:xsd="http://www.w3.org/2001/XMLSchema"
            targetNamespace="http://www.phicomm.com/XMLSchema"
            xmlns="http://www.phicomm.com/XMLSchema"
            elementFormDefault="qualified">

    <xsd:element name="id">
        <xsd:simpleType>
            <xsd:restriction base="xsd:string">
                <xsd:minLength value="1"/>
            </xsd:restriction>
        </xsd:simpleType>
    </xsd:element>

    <xsd:element name="name">
        <xsd:simpleType>
            <xsd:restriction base="xsd:string">
                <xsd:minLength value="1"/>
            </xsd:restriction>
        </xsd:simpleType>
    </xsd:element>

    <xsd:element name="description">
        <xsd:simpleType>
            <xsd:restriction base="xsd:string">
                <xsd:minLength value="1"/>
            </xsd:restriction>
        </xsd:simpleType>
    </xsd:element>

    <xsd:element name="permission">
        <xsd:complexType>
            <xsd:sequence>
                <xsd:element ref="id"/>
                <xsd:element ref="name"/>
                <xsd:element ref="description"/>
            </xsd:sequence>
        </xsd:complexType>
    </xsd:element>

    <xsd:element name="common-permission">
        <xsd:complexType>
            <xsd:sequence>
                <xsd:element ref="permission" minOccurs="1" maxOccurs="unbounded"/>
            </xsd:sequence>
        </xsd:complexType>
    </xsd:element>

    <xsd:element name="permissions">
        <xsd:complexType>
            <xsd:sequence>
                <xsd:element ref="permission" minOccurs="1" maxOccurs="unbounded"/>
            </xsd:sequence>
        </xsd:complexType>
    </xsd:element>

    <xsd:element name="permission-manager">
        <xsd:complexType>
            <xsd:sequence>
                <xsd:element ref="common-permission" minOccurs="1" maxOccurs="1"/>
                <xsd:element ref="permissions" minOccurs="1" maxOccurs="1"/>
            </xsd:sequence>
        </xsd:complexType>
    </xsd:element>

</xsd:schema>